{
  "schema_version": "1.0",
  "request": {
    "url": "http://127.0.0.1:8000/v1/messages",
    "headers": {
      "content-type": "application/json"
    },
    "body": {
      "model": "example-model"
    },
    "streaming": true
  },
  "status_code": 200,
  "headers": {
    "content-type": "text/event-stream"
  },
  "protocol_end": "message_stop",
  "capture_end": "eof",
  "tail": {
    "pending_data": false,
    "encoding_errors": 0,
    "limit_kind": null
  },
  "observed_bytes": 747,
  "retained_bytes": 747,
  "duration_ms": 2,
  "headers_ms": null,
  "error": null,
  "transformed": false,
  "transforms": [],
  "original_sha256": "3550ec593d853528f98807c6d7ac2d1d97485b3acb76702c8bf603f0eed528a9",
  "original_length": 747,
  "files": [
    {
      "path": "request.json",
      "sha256": "6a9436f5c8c1d51d574a3f3c9968c03b01103b74e4b50fbaf484b6898a438ef9",
      "event": null,
      "pointer": null
    },
    {
      "path": "body.bin",
      "sha256": "3550ec593d853528f98807c6d7ac2d1d97485b3acb76702c8bf603f0eed528a9",
      "event": null,
      "pointer": null
    },
    {
      "path": "reads.json",
      "sha256": "99346768a95c94ff294044968a65bf4f11d6a9ac6250b4ddb75edf7a1c6a10b9",
      "event": null,
      "pointer": null
    },
    {
      "path": "events.jsonl",
      "sha256": "4f49411a49939ab9f3eebe103cb9cf32734a477ea6952b77fde1d3cd0978d3f0",
      "event": null,
      "pointer": null
    }
  ]
}
